{"type":"config","name":"Match famous correspondents to Economist counts","metricName":"combined_error","metricUnit":"","bestDirection":"lower"}
{"run":1,"commit":"f6c3e41","metric":3.1005503789135433,"metrics":{"total_abs_delta":10351,"ratio_log_error":1.1703027997338356,"worst_person_error":0.6757181703943208,"matched_rows":11},"status":"keep","description":"Baseline: current correspondace.py reparses normalized headers, matches hand-picked Jeffrey aliases and candidate name_key combinations, and scores against famous_correspondents.csv.","timestamp":1774372412651,"segment":0,"confidence":null,"asi":{"hypothesis":"Baseline current heuristic matcher to establish combined_error before iterating.","baseline":true,"files":["correspondace.py","autoresearch.md","autoresearch.sh"],"observations":["Very close on Larry Summers, Michael Wolff, Thomas Pritzker, Steve Bannon.","Largest misses are Ariane de Rothschild, Elon Musk, Bill Gates, Reid Hoffman, Kathryn Ruemmler, Lawrence Krauss.","Current logic only searches name_key combinations; it barely uses actual email aliases and likely under-covers Jeffrey aliases."],"next_action_hint":"Improve candidate generation with email-key support and stricter junk/relative filtering for high-error correspondents."}}
{"run":2,"commit":"cef9618","metric":3.0555750097914727,"metrics":{"total_abs_delta":10321,"ratio_log_error":1.13069203342668,"worst_person_error":0.6310507819933376,"matched_rows":11},"status":"keep","description":"Backfill pure-email rows into candidate search by falling back from name_key to an email-derived search_key, and use that same key for Jeffrey alias detection.","timestamp":1774372582876,"segment":0,"confidence":null,"asi":{"hypothesis":"Many misses come from rows that only contain an email address; if those rows get searchable keys, undercounted correspondents should recover a chunk of missing volume.","observations":["combined_error improved from 3.1006 to 3.0556.","ratio_log_error improved from 1.1703 to 1.1307.","This helps aggregate coverage a bit but does not fix the biggest alias problems; Bill Gates and Elon Musk barely moved, suggesting those are more about bad candidate inclusion/exclusion than missing pure-email rows."],"next_action_hint":"Inspect the worst correspondents and tighten candidate filters or add person-specific email/domain heuristics for Ariane, Elon, Bill, Reid, Kathryn, and Krauss."}}
{"run":3,"commit":"cef9618","metric":3.5154502813261894,"metrics":{"total_abs_delta":12263,"ratio_log_error":1.3189593229881111,"worst_person_error":0.7068352876642969,"matched_rows":11},"status":"discard","description":"Tighten broad include tokens for Ariane, Elon, Kathryn, Krauss, and Bill by removing generic first-name triggers and biasing toward surname/email-domain keys.","timestamp":1774372767075,"segment":0,"confidence":1,"asi":{"hypothesis":"Broad include tokens like ariane, elon, bill, and lawrence were pulling in junk candidates, so stricter surname/email-domain matching might cut false positives and improve worst-person fits.","rollback_reason":"The stricter filters removed too much useful coverage and made combined_error worse, jumping from 3.0556 to 3.5155 with much larger total delta.","observations":["Ariane and other undercounted correspondents appear to need some of the broader aliases or email-only variants after all.","Elon barely improved despite extra Musk-specific filters, so his error is not mainly from the worst broad-token false positives.","Bill Gates selection worsened when generic bill-based support was removed."],"next_action_hint":"Revert to the previous broader search, then target one person at a time with additive person-specific email aliases instead of globally tightening include rules."}}
{"run":4,"commit":"cef9618","metric":3.0790673190729,"metrics":{"total_abs_delta":9384,"ratio_log_error":1.3188517411603773,"worst_person_error":0.6478739912145737,"matched_rows":11},"status":"discard","description":"Auto-derive extra Jeffrey alias keys from sender rows that use known Jeffrey email addresses, then reuse those learned keys when identifying Jeffrey as recipient/sender.","timestamp":1774372959259,"segment":0,"confidence":2,"asi":{"hypothesis":"A lot of undercounted correspondents may be missing because Jeffrey appears under many garbled recipient aliases not covered by the tiny manual alias list.","rollback_reason":"The broader Jeffrey alias set reduced total_abs_delta but increased ratio_log_error enough to worsen the primary combined_error from 3.0556 to 3.0791.","observations":["This confirms there is missing Jeffrey alias coverage in the data, but naive expansion picks up asymmetrical aliases that distort ratios.","The change likely inflated one side of the exchange graph more than the other.","A more careful approach would learn aliases separately for sender and recipient contexts or require both email-backed evidence and recipient-side frequency."],"next_action_hint":"Try person-specific fixes next, or learn stronger Jeffrey aliases with stricter filters instead of broad auto-expansion."}}
{"run":5,"commit":"cef9618","metric":0,"metrics":{"total_abs_delta":0,"ratio_log_error":0,"worst_person_error":0,"matched_rows":0},"status":"crash","description":"Try direction-specific matching by choosing sender-side and recipient-side key subsets independently from implied target sent and received counts.","timestamp":1774373616012,"segment":0,"confidence":2,"asi":{"hypothesis":"The same alias set is probably not valid in both directions; choosing sender and recipient keys independently should fit asymmetric correspondents like Ariane and Bill much better.","rollback_reason":"Searching sender and recipient subsets separately across the full candidate list blew up runtime and hit the experiment timeout before producing metrics.","observations":["The idea is still promising, but naive exhaustive search is too expensive at current candidate widths.","Need pruning: smaller candidate lists, top-N per direction, greedy search, or beam search instead of full combinations."],"next_action_hint":"Prototype a cheaper beam search or cap hard people to a much smaller preferred candidate list before trying directional matching again."}}
{"run":6,"commit":"cef9618","metric":4.299387423004545,"metrics":{"total_abs_delta":6948,"ratio_log_error":2.5583896743053183,"worst_person_error":0.6995513438958092,"matched_rows":11},"status":"discard","description":"Use fast greedy direction-specific key picking to match implied sent and received totals independently instead of forcing one shared key set per person.","timestamp":1774373821425,"segment":0,"confidence":1,"asi":{"hypothesis":"A cheap directional picker might capture asymmetric aliases without the runtime blow-up of exhaustive sender/recipient subset search.","rollback_reason":"The greedy picker was too myopic and grabbed high-volume junk keys like billconover and jermaine, causing a huge ratio_log_error spike and much worse combined_error.","observations":["Greedy direction-specific search is unsafe without stronger candidate gating.","Independent sent/received fitting can easily overfit totals while matching the wrong person entirely.","The idea still seems structurally useful, but it needs very strict person-specific candidate pools or a better scoring function."],"next_action_hint":"Return to the shared-subset baseline and improve candidate generation/gating before trying directional matching again."}}
{"run":7,"commit":"cef9618","metric":3.144525383283497,"metrics":{"total_abs_delta":10423,"ratio_log_error":1.1898761900829944,"worst_person_error":0.7234756078336602,"matched_rows":11},"status":"discard","description":"Target only a few problem people: add Ariane email aliases to prefer lists and tighten Bill/Reid/Elon candidate includes to reduce generic-name junk.","timestamp":1774373958990,"segment":0,"confidence":0.8145245106450247,"asi":{"hypothesis":"A small amount of person-specific candidate curation might improve the hardest mismatches without destabilizing the whole matcher.","rollback_reason":"The targeted curation still worsened the primary metric, pushing combined_error from 3.0556 to 3.1445 and increasing both ratio and total error.","observations":["Bill still picked generic gate/bill-like junk despite tighter includes, so candidate ranking alone is not enough.","Ariane remains the main unsolved structural problem; adding email aliases did not bridge the large missing volume.","Small local tweaks are not beating the baseline shared-subset search."],"next_action_hint":"Either add stronger per-person candidate gating rules in the actual subset search, or inspect whether the target numbers require message-level deduplication/thread handling rather than only alias tweaks."}}
{"run":8,"commit":"cef9618","metric":3.302216801431484,"metrics":{"total_abs_delta":10697,"ratio_log_error":1.1258570248378443,"worst_person_error":0.6766261248497117,"matched_rows":11},"status":"discard","description":"Bias subset search toward curated aliases by adding a small penalty for picked keys outside each person's prefer list, and promote Ariane email aliases into that preferred set.","timestamp":1774374141488,"segment":0,"confidence":0.5056231621793389,"asi":{"hypothesis":"The matcher is overfitting with small generic keys; a light penalty on non-preferred aliases should keep the search on cleaner person-specific keys and avoid junk additions like Bill/Gates fragments.","rollback_reason":"The preference penalty cleaned up some local choices like Bill Gates, but it worsened overall combined_error from 3.0556 to 3.3022 by preventing useful non-preferred keys elsewhere.","observations":["Bill Gates became exact on total but ratio stayed off, so his remaining error is intrinsic to the main billgates bucket, not junk extras.","Ariane email aliases still did not solve the huge missing-volume problem.","Soft alias penalties are too blunt globally."],"next_action_hint":"If we revisit alias penalties, make them person-specific rather than global; otherwise pivot to a different counting model such as message-level dedupe/directness rules."}}
{"run":9,"commit":"cef9618","metric":0,"metrics":{"total_abs_delta":0,"ratio_log_error":0,"worst_person_error":0,"matched_rows":0},"status":"crash","description":"Test a more direct-exchange counting model by ignoring cc/bcc and only counting sender<->to_recipients links against Jeffrey.","timestamp":1774374323428,"segment":0,"confidence":0.5056231621793389,"asi":{"hypothesis":"The Economist numbers may be closer to direct exchanges than any-address participation, so dropping cc/bcc could reduce overshoots on Bill, Elon, and Reid.","rollback_reason":"The run hit the experiment timeout before producing metrics, so the effect on the primary metric is unknown.","observations":["Unexpectedly, this variant was slower enough to time out under the current 120s budget.","Need either a longer timeout for this workload or a quick ad hoc runtime check before retrying."],"next_action_hint":"If retrying direct-only counting, rerun with a larger timeout or speed up the subset search first."}}
{"run":10,"commit":"cef9618","metric":3.058954678152103,"metrics":{"total_abs_delta":10325,"ratio_log_error":1.1331421350258244,"worst_person_error":0.6310507819933376,"matched_rows":11},"status":"discard","description":"Swap correspondace.py to consume the richer precomputed data/email_addresses.parquet instead of reparsing emails.normalized.parquet in-place.","timestamp":1774376751258,"segment":0,"confidence":0.689034417607191,"asi":{"hypothesis":"Using the already repaired parsed-address table from nb.py should recover better display names and email repairs than the lightweight local reparse, potentially improving correspondence matching.","rollback_reason":"This was effectively flat to slightly worse than the current best kept metric (3.05895 vs 3.05558), so it does not justify changing the code path.","observations":["The richer parsed-address dataset reproduces almost exactly the same scores as the lighter in-file reparse.","That means current mismatch is not mostly from missing address parsing repairs; the remaining gap is in the matching/counting logic.","Runtime improved substantially, which could still matter if we later revisit more expensive search ideas."],"next_action_hint":"Use the faster parsed-address source as an optional implementation detail only if it enables a stronger search strategy that actually improves combined_error."}}
{"run":11,"commit":"cef9618","metric":2.61167022091596,"metrics":{"total_abs_delta":10182,"ratio_log_error":0.8932981562277859,"worst_person_error":0.6201686787885355,"matched_rows":11},"status":"discard","description":"Replace exhaustive subset search with a fast beam search over up to 18 candidates, using the richer parsed-address table to make broader candidate exploration cheap.","timestamp":1774377210244,"segment":0,"confidence":1,"asi":{"hypothesis":"The current exhaustive search is too constrained by a 12-candidate cap; a beam search over a wider candidate pool could find better subsets, especially for hard underfit names.","rollback_reason":"Although the primary metric dropped sharply, inspection showed the beam search was matching obviously wrong people like Peter Mandelson for Elon Musk and Ariane Dwyer for Ariane de Rothschild. This is benchmark overfitting, not a valid improvement.","observations":["Beam search itself is promising: runtime fell to ~18s and the optimizer found much lower numeric error.","The failure mode is poisoned candidate generation from broad first-name fragments like `erm`, `ariane`, `larry`, and `bill`.","A stricter surname/email-domain candidate gate paired with beam search may be a real path forward."],"next_action_hint":"Keep the beam-search structure but tighten include tokens for the most toxic names so junk candidates never enter the pool."}}
{"run":12,"commit":"cef9618","metric":3.533881521365811,"metrics":{"total_abs_delta":12537,"ratio_log_error":1.2645118709683032,"worst_person_error":0.6921525473374196,"matched_rows":11},"status":"discard","description":"Retry beam search with junk-resistant include tokens: remove toxic first-name fragments like ariane, larry, lawrence, bill, and erm from candidate generation for the worst overfitting cases.","timestamp":1774377315964,"segment":0,"confidence":0.36470193330183864,"asi":{"hypothesis":"The beam search itself looked promising, but candidate pools were poisoned by broad first-name fragments; tightening those pools should preserve speed while avoiding bogus matches.","rollback_reason":"The stricter candidate pools overshot in the other direction and produced a much worse combined_error of 3.5339.","observations":["Beam search without the broad first-name tokens lost too much legitimate coverage for several people.","This suggests the right fix is not just pruning includes globally; it likely needs smarter scoring or person-specific candidate validation.","Parsed-address + beam remains fast, but not yet trustworthy."],"next_action_hint":"Revert to the kept baseline and either build explicit person-specific allowlists for the problematic names or revisit a counting-model change with a fast implementation."}}
{"run":13,"commit":"cef9618","metric":3.1056793176535433,"metrics":{"total_abs_delta":10645,"ratio_log_error":1.1429663332050293,"worst_person_error":0.72897823016969,"matched_rows":11},"status":"discard","description":"Test a more direct-address counting model on the faster parsed-address source by counting only sender<->to_recipients links and ignoring cc/bcc participation.","timestamp":1774377425540,"segment":0,"confidence":0.8976347751550795,"asi":{"hypothesis":"The Economist counts may reflect more direct exchanges than any-address participation, so dropping cc/bcc might reduce false-positive volume for famous names without changing the basic alias logic.","rollback_reason":"The direct-only model completed quickly but slightly worsened the primary metric from 3.0556 to 3.1057.","observations":["This is a useful negative result: the target numbers are not simply explained by excluding cc/bcc.","Bill and Elon changed only modestly, so their mismatch is mostly not a cc/bcc artifact.","Using data/email_addresses.parquet does make these counting-model experiments much faster."],"next_action_hint":"Keep the baseline counting model. If revisiting counting changes, focus on dedupe or directness filters beyond simple cc/bcc removal."}}
{"run":14,"commit":"cef9618","metric":4.479401388188431,"metrics":{"total_abs_delta":6060,"ratio_log_error":3.3526817826611186,"worst_person_error":1.8594063209295764,"matched_rows":11},"status":"discard","description":"Prioritize matching total emails before ratio inside subset selection, and add a few strongly-evidenced Jeffrey alias variants like jeffepstein/jefffreyepstein/jeevacation.","timestamp":1774377693879,"segment":0,"confidence":0.36470193330183864,"asi":{"hypothesis":"If subset search picks the closest total first and only then optimizes ratio, it may satisfy the user's instruction and recover the large undercounts on names like Ariane and Krauss; a few extra Jeffrey aliases might help total coverage too.","rollback_reason":"Total-first ranking did shrink total_abs_delta sharply, but it blew up ratio error and made the primary combined_error much worse.","observations":["This confirms there is a real tradeoff: forcing exact totals encourages clearly wrong directional balance.","The extra Jeffrey aliases were not enough to overcome that tradeoff.","The current benchmark genuinely requires balancing total and ratio jointly even if total is explored first heuristically."],"next_action_hint":"Keep ratio in the inner objective, but use total-first ideas only as a tie-breaker or in constrained per-person searches where alias pools are trustworthy."}}
{"run":15,"commit":"a2a6709","metric":3.0539588094541754,"metrics":{"total_abs_delta":10317,"ratio_log_error":1.1290615031830653,"worst_person_error":0.6310507819933376,"matched_rows":11},"status":"keep","description":"Add only three strongly-evidenced Jeffrey alias variants with sender-email support—jefffreyepstein, jeffepstein, and jeevacation—without changing the matching objective.","timestamp":1774377835875,"segment":0,"confidence":0.9008335587069375,"asi":{"hypothesis":"The earlier Jeffrey alias expansion was too broad, but a tiny manually-curated set of aliases that also appear on known Jeffrey sender emails might recover missing volume without distorting ratios much.","observations":["This is a small but real numeric improvement over the previous best, from 3.0556 to 3.0540.","total_abs_delta and ratio_log_error both improved slightly, while worst_person_error stayed flat.","The result supports a narrow alias-expansion strategy: only aliases with strong sender-email evidence and clearly Jeffrey-like tokens seem safe."],"next_action_hint":"Inspect the top remaining Jeffrey-like aliases with both sender-email evidence and recipient volume, and add only similarly safe ones rather than doing broad auto-expansion."}}
{"run":16,"commit":"0fb985d","metric":3.053510603425342,"metrics":{"total_abs_delta":10316,"ratio_log_error":1.1287449974044623,"worst_person_error":0.6310507819933376,"matched_rows":11},"status":"keep","description":"Extend the narrow Jeffrey alias set with four more sender-email-backed typo/account variants: jefreyepstein, jeeproject, jeevacationmailcom, and jeevacationepstein.","timestamp":1774377994567,"segment":0,"confidence":0.9526051107146021,"asi":{"hypothesis":"A few additional Jeffrey aliases with both obvious semantic similarity and known Jeffrey sender-email evidence may recover a little more missing volume without the ratio damage from broad alias expansion.","observations":["Another small numeric improvement: 3.0540 -> 3.0535.","Both total_abs_delta and ratio_log_error improved again while worst_person_error stayed unchanged.","Safe Jeff alias expansion still seems additive, but each extra alias now yields diminishing returns."],"next_action_hint":"Mine the remaining Jeffrey-like aliases more conservatively, or pivot to a different structural idea once the next few safe aliases stop helping."}}
{"run":17,"commit":"0fb985d","metric":3.093454392794696,"metrics":{"total_abs_delta":9797,"ratio_log_error":1.2700059257214036,"worst_person_error":0.6310507819933376,"matched_rows":11},"status":"discard","description":"Add two more Jeff-like aliases with sender-email support—epsteinjeffrey and jffreyepstein—to see if recipient undercounts can be reduced further.","timestamp":1774378182028,"segment":0,"confidence":1.0096198954882691,"asi":{"hypothesis":"`epsteinjeffrey` looked especially promising because it had huge recipient-side volume and some sender-email evidence, so it might recover missing direct-to-Jeff traffic without much collateral damage.","rollback_reason":"These aliases did cut total_abs_delta, but they distorted directional counts enough to worsen combined_error from 3.0535 to 3.0935.","observations":["`epsteinjeffrey` is too asymmetric: it adds lots of recipient-side volume relative to sender-side evidence.","The safe Jeffrey alias frontier is narrower than it looked; beyond the already-kept additions, more aliases quickly hurt ratio quality.","Future Jeff alias additions should probably require stronger sender/recipient balance, not just sender evidence plus semantic plausibility."],"next_action_hint":"Stop expanding Jeffrey aliases greedily. Pivot to balance-aware alias admission or a different structural idea like dedupe/validated allowlists."}}
