{"run":72,"commit":"f9f6e8d","metric":0,"metrics":{"total_abs_delta":0,"ratio_log_error":0,"worst_person_error":0,"matched_rows":0},"status":"crash","description":"Raise Lawrence Krauss candidate cap from 17 to 20 to expose more low-volume Krauss variants to the anchored directional local search.","timestamp":1774390963622,"segment":0,"confidence":3.9798465510440075,"asi":{"hypothesis":"The anchored local directional search is still improving mainly through Lawrence, so letting it see a few more specific Krauss variants just beyond the old cutoff might yield another gain.","rollback_reason":"The larger Lawrence candidate pool made the search blow past the benchmark timeout, so this expansion is too expensive in the current brute-force form.","error_details":"./autoresearch.sh timed out after 600s before producing metrics.","observations":["The current search complexity is very sensitive to Lawrence pool size now that the directional local refinement considers many combinations of extras.","Simple candidate-cap expansion is no longer cheap once the local directional search is in place.","Any further Lawrence pool growth would need pruning or a cheaper local-search implementation first."],"next_action_hint":"Keep Lawrence at 17 and instead optimize the local directional search implementation or target another person with a smaller candidate pool."}}
{"run":73,"commit":"709d2f8","metric":2.9877414828217788,"metrics":{"total_abs_delta":10115,"ratio_log_error":1.0533044169351078,"worst_person_error":0.6115433562852444,"matched_rows":11},"status":"keep","description":"Cache the anchored directional extra-union sets so the local search stays fast enough to let Lawrence Krauss use a 20-key candidate pool.","timestamp":1774391558849,"segment":0,"confidence":4.091115921952382,"asi":{"hypothesis":"Lawrence still had promising low-volume Krauss variants just beyond the old candidate cap, and the only thing stopping that search was combinatorial overhead inside the anchored directional refinement.","observations":["combined_error improved from 2.990810 to 2.987741.","total_abs_delta improved from 10122 to 10115.","ratio_log_error improved from 1.055451 to 1.053304.","Precomputing extra-union sets was enough to keep the richer Lawrence search under the benchmark timeout and unlock another real improvement."],"next_action_hint":"Inspect the new Lawrence picks and, if the useful extras are still clearly Krauss-specific, consider one more modest Lawrence cap bump or a similarly optimized extension for another proven cap-sensitive person."}}
{"run":74,"commit":"709d2f8","metric":0,"metrics":{"total_abs_delta":0,"ratio_log_error":0,"worst_person_error":0,"matched_rows":0},"status":"crash","description":"Push Lawrence Krauss one more slot to a 21-key candidate pool now that the directional local search is cached.","timestamp":1774392185953,"segment":0,"confidence":4.091115921952382,"asi":{"hypothesis":"The optimized anchored directional search reopened Lawrence headroom at cap 20, so one more candidate might still expose another specific Krauss-side alias.","rollback_reason":"Even with cached extra unions, moving Lawrence to 21 candidates pushed the full search back over the 600s timeout.","error_details":"./autoresearch.sh timed out after 600s with the 21-key Lawrence pool.","observations":["The current implementation can sustain Lawrence at 20 candidates but not 21 under the benchmark limit.","Lawrence still looks promising, but further cap growth now needs a cheaper shared-subset search too, not just faster directional refinement.","The timeout boundary is now sharp enough that blind cap increases are stale."],"next_action_hint":"Keep Lawrence at 20 and either optimize the shared subset enumeration or switch to another promising person-specific tweak."}}
{"run":75,"commit":"709d2f8","metric":0,"metrics":{"total_abs_delta":0,"ratio_log_error":0,"worst_person_error":0,"matched_rows":0},"status":"crash","description":"Raise Reid Hoffman from a 16-key to a 17-key candidate pool on top of the current Lawrence-20 anchored directional search.","timestamp":1774392806513,"segment":0,"confidence":4.091115921952382,"asi":{"hypothesis":"Reid had prior wins from small cap increases, so one more slot might still expose a useful specific Hoffman variant now that the stronger Lawrence search is in place.","rollback_reason":"This pushed the overall search over the benchmark timeout, so the current global search budget is already near its limit.","error_details":"./autoresearch.sh timed out after 600s with Reid at 17 candidates.","observations":["The current best configuration is computationally tight enough that even modest extra search on another hard case can tip it over the timeout.","Search-budget improvements now need to be traded, not just added.","Future cap increases probably require offsetting reductions elsewhere or a cheaper enumeration strategy."],"next_action_hint":"Keep Reid at 16 for now and consider reducing search width somewhere unproductive before spending that budget on another hard case."}}
{"run":76,"commit":"5b581fb","metric":0,"metrics":{"total_abs_delta":0,"ratio_log_error":0,"worst_person_error":0,"matched_rows":0},"status":"crash","description":"Rebaseline rerun timed out at 600s before metrics; no comparable score produced.","timestamp":1774994248764,"segment":0,"confidence":4.091115921952382,"iterationTokens":null,"asi":{"hypothesis":"Confirm current runtime/metric behavior before introducing new matching signals.","rollback_reason":"Run exceeded 600s timeout and produced no METRIC lines.","next_action_hint":"Reduce search overhead first, then test new alias signals from jmail.person/world mappings."}}
{"run":77,"commit":"5b581fb","metric":2.98799555394881,"metrics":{"total_abs_delta":10113,"ratio_log_error":1.0547098985399743,"worst_person_error":0.6115433562852444,"matched_rows":11},"status":"discard","description":"Speed pass: precompute Jeff-linked sender/recipient id sets per search_key and reuse them in subset evaluation instead of refiltering addresses and intersecting Jeff ids inside each combination.","timestamp":1774994592972,"segment":0,"confidence":4.091115921952382,"iterationTokens":8768,"asi":{"hypothesis":"Most runtime is spent rebuilding per-key id sets and repeating Jeff intersections inside tight combination loops; caching Jeff-linked key->id sets should make runs faster without changing scores.","rollback_reason":"Primary metric regressed slightly versus best keep (2.987741 -> 2.987996), so despite major runtime gain this exact code path should not replace best scorer.","next_action_hint":"Keep the speed pattern, but verify exact equivalence by ensuring all Jeff-alias conditions are unchanged, then layer in jmail person-email hints on top.","observations":["Runtime improved dramatically (completed in 136s instead of timeout).","Result is very close but not identical, indicating subtle behavioral drift, likely from how empty/missing keys are grouped."]}}
{"run":78,"commit":"5b581fb","metric":0,"metrics":{"total_abs_delta":0,"ratio_log_error":0,"worst_person_error":0,"matched_rows":0},"status":"crash","description":"Add global key->id caching plus jmail person-email prefer hints from scraped pages; run timed out at 600s before metrics.","timestamp":1774995417728,"segment":0,"confidence":4.091115921952382,"iterationTokens":6792,"asi":{"hypothesis":"Caching per-key id sets should reduce repeated dataframe filters, and jmail person email hints might improve candidate quality for hard names.","rollback_reason":"The combined change exceeded runtime budget and timed out before any METRIC output.","next_action_hint":"Split concerns: keep runtime-only optimization first (no new candidate hints), then reintroduce tightly filtered jmail hints for one or two people only.","observations":["Adding jmail hints likely increased candidate pools and combination cost.","Need hard cap safeguards when injecting external prefer keys."]}}
{"run":79,"commit":"4f919b4","metric":2.9877414828217788,"metrics":{"total_abs_delta":10115,"ratio_log_error":1.0533044169351078,"worst_person_error":0.6115433562852444,"matched_rows":11},"status":"keep","description":"Speed up search by precomputing Jeff-linked sender/recipient id sets per key and reusing them in subset/directional scoring.","timestamp":1774995552989,"segment":0,"confidence":4.238680355995612,"iterationTokens":1568,"asi":{"hypothesis":"Most wall time is repeated per-key filtering and Jeff intersection inside combinational loops; caching Jeff-linked key id sets should preserve behavior and cut runtime sharply.","observations":["Runtime dropped to 110s (from repeated timeouts at 600s).","Primary metric improved strongly to 2.987741 in this segment while preserving the same picked-key behavior seen in earlier good runs.","This gives enough headroom to test person-email hint ideas without immediate timeout."]}}
{"run":80,"commit":"4f919b4","metric":2.9877414828217788,"metrics":{"total_abs_delta":10115,"ratio_log_error":1.0533044169351078,"worst_person_error":0.6115433562852444,"matched_rows":11},"status":"discard","description":"Use jmail-derived Elon alias signal safely: add exact include token `ermspacexcom` instead of broad `erm` substring.","timestamp":1774995997152,"segment":0,"confidence":4.826688806527156,"iterationTokens":6131,"asi":{"hypothesis":"`erm@spacex.com` appears on jmail's Elon page and exists in local address keys; adding just that exact token could recover real Elon traffic without the old broad `erm` overmatch.","rollback_reason":"No measurable change in metric or chosen solution, so this extra include is redundant.","next_action_hint":"Try person-email hints that can actually alter candidate order/selection (e.g., Elon candidate cap or targeted prefer-order boost), and keep runtime-focused changes.","observations":["Runtime improved further to ~94s but scoring remained identical.","The key likely already enters or is dominated in combinations and doesn't affect the best subset."]}}
{"run":81,"commit":"4f919b4","metric":2.9877414828217788,"metrics":{"total_abs_delta":10115,"ratio_log_error":1.0533044169351078,"worst_person_error":0.6115433562852444,"matched_rows":11},"status":"discard","description":"Spend new runtime headroom by raising Elon Musk candidate cap from 13 to 14.","timestamp":1774996100513,"segment":0,"confidence":4.8635896538638415,"iterationTokens":1593,"asi":{"hypothesis":"After the caching speedup, Elon might benefit from one additional candidate without timeout pressure.","rollback_reason":"Metric and selected solution were unchanged; extra Elon slot added no effective search headroom.","next_action_hint":"Target candidate quality/order for Elon rather than raw cap width, or apply jmail-derived hints to names where keys are currently clipped.","observations":["Runtime dropped to ~85s even with wider cap, so speed headroom is now solid.","Elon appears constrained by alias quality, not cap count."]}}
{"run":82,"commit":"4f919b4","metric":2.9877414828217788,"metrics":{"total_abs_delta":10115,"ratio_log_error":1.0533044169351078,"worst_person_error":0.6115433562852444,"matched_rows":11},"status":"discard","description":"Use speed headroom to raise Reid Hoffman candidate cap from 16 to 17.","timestamp":1774996201736,"segment":0,"confidence":4.901059074400653,"iterationTokens":1552,"asi":{"hypothesis":"Reid had earlier cap sensitivity; with fast cached sets, 17 candidates might unlock another better alias mix.","rollback_reason":"No metric or output change; Reid’s winning subset is stable under this extra slot.","next_action_hint":"Try levers that change candidate ranking/eligibility (not just cap), especially for Ariane and Elon.","observations":["Runtime remained fast (~82s).","Current configuration seems at a local plateau for pure cap increases."]}}
{"run":83,"commit":"6efe53d","metric":2.984647701810556,"metrics":{"total_abs_delta":10111,"ratio_log_error":1.050737436924807,"worst_person_error":0.6115433562852444,"matched_rows":11},"status":"keep","description":"Use runtime headroom from cached Jeff-linked key sets to raise Lawrence Krauss candidate cap from 20 to 21.","timestamp":1774996398999,"segment":0,"confidence":4.886667864310038,"iterationTokens":1321,"asi":{"hypothesis":"Lawrence remained the most cap-sensitive hard case; now that caching made runs fast, one more candidate should unlock additional Krauss-side coverage.","observations":["Primary metric improved from 2.987741 to 2.984648.","Both total_abs_delta and ratio_log_error improved.","Run time stayed acceptable at ~177s, so this higher cap is now viable without timing out."]}}
{"run":84,"commit":"aac3255","metric":2.9833358706679345,"metrics":{"total_abs_delta":10108,"ratio_log_error":1.0498207065328766,"worst_person_error":0.6115433562852444,"matched_rows":11},"status":"keep","description":"Push Lawrence Krauss candidate cap one more step, from 21 to 22, using the faster cached-id implementation.","timestamp":1774996595603,"segment":0,"confidence":5.429235892274723,"iterationTokens":1288,"asi":{"hypothesis":"Lawrence still had useful candidates just beyond 21; with runtime now stable, another slot can improve total/ratio fit.","observations":["Primary metric improved again: 2.984648 -> 2.983336.","total_abs_delta and ratio_log_error both improved.","Runtime remained around 176s, so this expansion is still practical."]}}
{"run":85,"commit":"aac3255","metric":2.9833358706679345,"metrics":{"total_abs_delta":10108,"ratio_log_error":1.0498207065328766,"worst_person_error":0.6115433562852444,"matched_rows":11},"status":"discard","description":"Test Lawrence Krauss cap 23 after gains at 21/22.","timestamp":1774996865756,"segment":0,"confidence":5.399007853432044,"iterationTokens":1270,"asi":{"hypothesis":"Lawrence might still have one more useful alias beyond 22.","rollback_reason":"No primary improvement, while runtime jumped substantially (~256s), so extra cap is not worth it.","next_action_hint":"Keep Lawrence at 22 and spend headroom on candidate-quality tweaks (possibly jmail-derived) rather than further brute-force width.","observations":["Metric stayed exactly flat vs cap 22.","Cap 23 increases compute cost sharply for no gain."]}}
{"run":86,"commit":"22ae53c","metric":2.9831110013202227,"metrics":{"total_abs_delta":10103,"ratio_log_error":1.0512895470122412,"worst_person_error":0.6110644158105015,"matched_rows":11},"status":"keep","description":"Raise Ariane de Rothschild candidate cap from 14 to 15 while keeping Lawrence at 22.","timestamp":1774997055727,"segment":0,"confidence":5.521265830328321,"iterationTokens":1379,"asi":{"hypothesis":"With faster cached scoring, Ariane may still have one useful alias just beyond her old cap to reduce the dominant worst-person undercount.","observations":["Primary metric improved from 2.983336 to 2.983111.","total_abs_delta and worst_person_error both improved; ratio_log_error worsened slightly but net primary improved.","Runtime remained acceptable (~171s)."]}}
{"run":87,"commit":"cee7a87","metric":2.9828569301931913,"metrics":{"total_abs_delta":10105,"ratio_log_error":1.0498840654073747,"worst_person_error":0.6110644158105015,"matched_rows":11},"status":"keep","description":"Push Ariane de Rothschild candidate cap from 15 to 16 on top of cached-id speedups and Lawrence 22.","timestamp":1774997240870,"segment":0,"confidence":5.389532119614418,"iterationTokens":1291,"asi":{"hypothesis":"Ariane still appears cap-sensitive; one more candidate could improve her ratio/total tradeoff despite large undercount.","observations":["Primary improved again: 2.983111 -> 2.982857.","ratio_log_error improved enough to offset a tiny total_abs_delta regression.","Runtime stayed stable (~169s)."]}}
{"run":88,"commit":"03ff315","metric":2.980830342788272,"metrics":{"total_abs_delta":10091,"ratio_log_error":1.050388208298912,"worst_person_error":0.609037828405582,"matched_rows":11},"status":"keep","description":"Increase Ariane de Rothschild candidate cap to 17 while keeping Lawrence at 22.","timestamp":1774997485561,"segment":0,"confidence":5.265064163158352,"iterationTokens":1296,"asi":{"hypothesis":"Ariane remains the worst-person bottleneck and still has useful aliases beyond cap 16; one more slot may reduce her large undercount materially.","observations":["Primary improved notably: 2.982857 -> 2.980830.","total_abs_delta improved strongly (10105 -> 10091) and worst_person_error improved (0.611064 -> 0.609038).","Runtime increased to ~232s but remains within budget."]}}
{"run":89,"commit":"03ff315","metric":2.980830342788272,"metrics":{"total_abs_delta":10091,"ratio_log_error":1.050388208298912,"worst_person_error":0.609037828405582,"matched_rows":11},"status":"discard","description":"Probe one more Ariane expansion: raise her candidate cap from 17 to 18.","timestamp":1774997790961,"segment":0,"confidence":5.150476909567372,"iterationTokens":1300,"asi":{"hypothesis":"Ariane’s sharp gain at 17 suggested one more tail alias might still help.","rollback_reason":"No primary gain and runtime jumped to ~290s, so cap 18 is not worth it.","next_action_hint":"Keep Ariane at 17; look for targeted quality changes (including jmail-backed aliases) rather than wider brute-force pools.","observations":["Metric stayed exactly flat vs Ariane 17.","Compute cost rose significantly."]}}
{"run":90,"commit":"03ff315","metric":2.9852359549421164,"metrics":{"total_abs_delta":10098,"ratio_log_error":1.0538719187011432,"worst_person_error":0.609037828405582,"matched_rows":11},"status":"discard","description":"Inject jmail-derived email-key prefers for Lawrence (lawkraussgmailcom/lkraussasuedu) and Reid (rhoffmangreylockcom).","timestamp":1774998071648,"segment":0,"confidence":5.123789861357996,"iterationTokens":1574,"asi":{"hypothesis":"Person-page email aliases from jmail could improve candidate ordering for hard names without broad token changes.","rollback_reason":"Primary metric regressed (2.980830 -> 2.985236), so these prefers over-biased ordering toward weaker combinations.","next_action_hint":"Keep jmail aliases for diagnostics/scraping, but do not force them into prefer order; use them only as optional candidate admission with contribution thresholds.","observations":["total_abs_delta improved slightly, but ratio_log_error worsened enough to hurt primary.","Runtime increased due changed search paths."]}}
{"run":91,"commit":"03ff315","metric":2.9816438204262434,"metrics":{"total_abs_delta":10092,"ratio_log_error":1.0510209194871367,"worst_person_error":0.6098513060435535,"matched_rows":11},"status":"discard","description":"Re-open Reid headroom on top of the new best settings: raise Reid candidate cap from 16 to 17 (Lawrence 22, Ariane 17 retained).","timestamp":1774998211370,"segment":0,"confidence":5.096083066600198,"iterationTokens":1999,"asi":{"hypothesis":"Reid cap may become useful once Ariane/Lawrence deeper pools shift shared search dynamics.","rollback_reason":"Primary regressed slightly versus best keep (2.980830 -> 2.981644).","next_action_hint":"Keep Reid at 16; next focus should be Ariane/Elon candidate quality or bounded directional refinement settings.","observations":["Run stayed fast (~116s).","Change mainly traded ratio and worst-person behavior without net gain."]}}
{"run":92,"commit":"4ca0fe0","metric":2.980749656829719,"metrics":{"total_abs_delta":10093,"ratio_log_error":1.0499459894408651,"worst_person_error":0.6089571424470289,"matched_rows":11},"status":"keep","description":"Increase Ariane shared-subset max width from 10 to 11 (same as Lawrence) while keeping candidate caps (Lawrence 22, Ariane 17).","timestamp":1775000095214,"segment":0,"confidence":5.072090368287289,"iterationTokens":1999,"asi":{"hypothesis":"After opening Ariane's candidate cap, her subset width cap may now be the active bottleneck; allowing one more shared key could reduce worst-person undercount.","observations":["Primary improved from 2.980830 to 2.980750.","worst_person_error improved to 0.608957 and ratio_log_error improved.","Runtime remained fast (~111s), so this change is low-cost."]}}
