{"run":55,"commit":"01fdb95","metric":3.056879073740488,"metrics":{"total_abs_delta":10225,"ratio_log_error":1.097363055575642,"worst_person_error":0.6600274880448481,"matched_rows":11},"status":"discard","description":"Sort candidate keys by Jeff-connected contribution counts before raw corpus frequency, instead of sorting only by global key frequency.","timestamp":1774386273144,"segment":0,"confidence":3.9717118350713125,"asi":{"hypothesis":"Recent wins from cap tuning suggest the search is bottlenecked by ordering, so ranking candidates by actual Jeff-side contribution might surface better aliases earlier than global frequency does.","rollback_reason":"This massively worsened the primary metric, meaning contribution-first ordering over-prioritized noisy Jeff-connected aliases and destabilized several matches.","observations":["The metric regressed all the way back near the earlier 3.06 regime.","Global frequency is acting as an important regularizer against junk Jeff-connected keys.","Ordering changes are much riskier than selective per-person cap/width tuning."],"next_action_hint":"Revert to len ordering and keep exploring narrowly-scoped search-budget changes or stronger evidence-gated Jeffrey alias learning."}}
{"run":56,"commit":"01fdb95","metric":3.0060244129564744,"metrics":{"total_abs_delta":10166,"ratio_log_error":1.0641285048378317,"worst_person_error":0.614822263553858,"matched_rows":11},"status":"discard","description":"Give Steve Bannon one extra candidate slot because his current match still uses generic 'steve' aliases from a very deep candidate list.","timestamp":1774386571135,"segment":0,"confidence":3.945255066534189,"asi":{"hypothesis":"Steve's candidate cap may still be clipping a more specific Bannon alias that could replace a generic Steve key and trim his residual error.","rollback_reason":"The extra Steve slot made no difference at all, so his current solution is not constrained by the 12-key cap.","observations":["Steve's remaining error is not hidden just beyond the current candidate cutoff.","The successful cap wins are staying concentrated in a few hard cases, not the mid-error rows.","Another generic cap bump without stronger evidence is likely stale."],"next_action_hint":"Prune generic 'just add one more slot' ideas for mid-error rows and focus on evidence-backed structural changes or the few proven cap-sensitive names."}}
{"run":57,"commit":"01fdb95","metric":3.0749994994818617,"metrics":{"total_abs_delta":9379,"ratio_log_error":1.2619886689167452,"worst_person_error":0.6350516802323849,"matched_rows":11},"status":"discard","description":"Add a tiny recipient-only Jeffrey alias expansion using sender-email-backed keys like 'j', 'jee', 'jeff', 'jejail', and 'jeffreyemailto'.","timestamp":1774386901701,"segment":0,"confidence":3.916617554905284,"asi":{"hypothesis":"A few short Jeff display-name variants repeatedly appear on messages sent from Jeff's known email accounts, so using them only on the recipient side might recover real inbound-to-Jeff mail without the asymmetry of broad alias expansion.","rollback_reason":"Even this constrained recipient-only Jeff alias expansion hurt the primary metric badly by inflating ratio error more than it helped total coverage.","observations":["The total_abs_delta improvement was real but came with a large ratio_log_error regression.","This confirms the benchmark is extremely sensitive to asymmetric Jeff alias growth, even when the aliases are sender-email-backed.","Jeff alias recovery remains promising only if it can be made symmetric or person-validated."],"next_action_hint":"Keep the Jeff alias idea in the backlog but narrow it further, perhaps requiring both email evidence and balanced sender/recipient behavior before admitting a new alias."}}
{"run":58,"commit":"01fdb95","metric":3.1008171011018275,"metrics":{"total_abs_delta":10340,"ratio_log_error":1.1399101705617831,"worst_person_error":0.7014568364791821,"matched_rows":11},"status":"discard","description":"Test a direct-address counting model by using only to_recipients instead of to/cc/bcc for recipient-side matching.","timestamp":1774387095478,"segment":0,"confidence":3.823599416579228,"asi":{"hypothesis":"If the Economist totals are closer to direct exchanges than broad participation, counting only primary recipients might reduce alias noise and improve the fit.","rollback_reason":"The direct-address model regressed back to baseline-level error, so the target counts clearly depend on broader recipient participation than just the To field.","observations":["This strongly weakens the 'direct only' counting-model idea.","The benchmark seems closer to all-recipient participation than to direct-address mail only.","Counting-model changes need to be subtler than dropping cc/bcc entirely."],"next_action_hint":"Prune the naive 'To-only' idea from the backlog and, if revisiting counting models, focus on dedupe or more nuanced directness filters instead."}}
{"run":59,"commit":"01fdb95","metric":3.019451982859412,"metrics":{"total_abs_delta":10132,"ratio_log_error":1.086919191681534,"worst_person_error":0.614822263553858,"matched_rows":11},"status":"discard","description":"Use Jeff-owned mailbox metadata by treating emails with a known Jeff account_email_normalized as recipient-side Jeff messages too.","timestamp":1774387388068,"segment":0,"confidence":3.916617554905284,"asi":{"hypothesis":"Some inbound-to-Jeff messages may miss a clean recipient alias but still live in one of Jeff's mailbox accounts, so account_email_normalized could recover real recipient-side coverage without relying on noisy display names.","rollback_reason":"Mailbox-account evidence improved total coverage but still hurt the primary metric by worsening ratio error too much.","observations":["This was much safer than broad Jeff alias expansion but still not good enough to keep.","account_email_normalized is a real signal for missing Jeff recipient coverage.","A future version might use account-email evidence only for undercounted people or only when recipient headers are empty/missing."],"next_action_hint":"If revisiting account-email evidence, gate it much more tightly—e.g. only for messages with no recognized Jeff recipient alias already present."}}
{"run":60,"commit":"01fdb95","metric":3.019097330005774,"metrics":{"total_abs_delta":10142,"ratio_log_error":1.0851463534831345,"worst_person_error":0.614822263553858,"matched_rows":11},"status":"discard","description":"Gate Jeff account-email recipient recovery down to messages with zero recipient emails, instead of all Jeff-owned mailbox messages.","timestamp":1774387662352,"segment":0,"confidence":3.945255066534189,"asi":{"hypothesis":"Mailbox-account evidence may only be trustworthy when recipient headers are completely missing, so a zero-recipient-email gate could recover true inbound Jeff mail with less ratio distortion.","rollback_reason":"The tighter gate was safer but still worse than the current best, so even missing-recipient mailbox recovery remains too asymmetric in aggregate.","observations":["This outperformed the ungated account-email expansion but still did not beat the baseline best.","Mailbox-account metadata is real signal, but using it globally still nudges ratios the wrong way.","If revisited, it likely needs person-level or alias-level validation rather than a global rule."],"next_action_hint":"Record mailbox-account recovery as a deferred idea and go back to person-specific search-space tuning or more constrained directional validation."}}
{"run":61,"commit":"01fdb95","metric":3.0060244129564744,"metrics":{"total_abs_delta":10166,"ratio_log_error":1.0641285048378317,"worst_person_error":0.614822263553858,"matched_rows":11},"status":"discard","description":"Give Thomas Pritzker one extra candidate slot because his candidate list is still very deep despite a mid-sized residual error.","timestamp":1774388025914,"segment":0,"confidence":3.97431444610643,"asi":{"hypothesis":"Thomas may have the same mild search-budget issue as the other large-volume names, with one more candidate unlocking a slightly better subset.","rollback_reason":"The extra Thomas slot changed nothing at all, so his current fit is not constrained by the 12-key cap.","observations":["Thomas behaves like Steve and Noam here: deep list, but no practical cap bottleneck.","Search-budget gains remain highly person-specific rather than broadly applicable.","Generic cap bumps are increasingly stale outside Lawrence/Ariane/Reid/Bill."],"next_action_hint":"Stop trying generic cap bumps on non-responsive names and focus on a more structural Ariane/Elon/Jeff idea."}}
{"run":62,"commit":"01fdb95","metric":10.57982579294089,"metrics":{"total_abs_delta":45674,"ratio_log_error":0.15907571724373412,"worst_person_error":1.0677500854256998,"matched_rows":11},"status":"discard","description":"Try a deduped counting model by collapsing messages with identical normalized sender/to/cc/bcc headers before scoring correspondents.","timestamp":1774388241401,"segment":0,"confidence":3.945255066534189,"asi":{"hypothesis":"The Economist totals might be closer to deduped conversation/header instances than raw copied mailbox rows, so counting unique normalized message headers could reduce inflated totals without cheating.","rollback_reason":"Full header-level deduplication catastrophically undercounted nearly everyone and blew up combined_error, so the target clearly expects much more of the duplicated mailbox volume.","observations":["Ratio error became tiny while total_abs_delta exploded, indicating the dedupe preserved directionality but removed far too much mass.","A global duplicate collapse is much too aggressive for this benchmark.","If dedupe is revisited at all, it must be much narrower than raw normalized-header uniqueness."],"next_action_hint":"Revert the dedupe model and focus on alias-quality improvements or tightly gated counting changes rather than full global deduplication."}}
{"run":63,"commit":"e85c860","metric":3.0027455056878605,"metrics":{"total_abs_delta":10150,"ratio_log_error":1.063741860765169,"worst_person_error":0.6115433562852444,"matched_rows":11},"status":"keep","description":"Add a constrained Ariane directional local search: start from the best shared alias set, then allow at most one extra sender-only alias and one extra recipient-only alias.","timestamp":1774388415707,"segment":0,"confidence":4.112175068774007,"asi":{"hypothesis":"Ariane's big undercount may come from one asymmetric alias on each side, but the fully independent directional search overfit badly, so a local one-extra-per-side refinement could recover volume without losing the strong ratio fit.","observations":["combined_error improved from 3.0060 to 3.0027.","worst_person_error improved from 0.6148 to 0.6115.","total_abs_delta improved from 10166 to 10150 while ratio_log_error also improved slightly from 1.0641 to 1.0637.","This is the first successful directional-style change because it stayed tightly anchored to the already-good shared Ariane core."],"next_action_hint":"Inspect which Ariane side-specific extras were chosen, then consider applying the same constrained local directional refinement to Lawrence or another asymmetric hard case."}}
{"run":64,"commit":"86df333","metric":2.9961382196882798,"metrics":{"total_abs_delta":10135,"ratio_log_error":1.0591100785190453,"worst_person_error":0.6115433562852444,"matched_rows":11},"status":"keep","description":"Apply the same constrained one-extra-per-side directional local search to Lawrence Krauss, not just Ariane de Rothschild.","timestamp":1774388565257,"segment":0,"confidence":4.389976326151442,"asi":{"hypothesis":"Lawrence also looks like an asymmetric hard case with a good shared core and a large remaining total miss, so the same local directional refinement may recover one more useful alias per side without the blow-up from full independent search.","observations":["combined_error improved from 3.0027 to 2.9961.","total_abs_delta improved from 10150 to 10135.","ratio_log_error improved from 1.0637 to 1.0591.","The constrained directional idea now has repeatable wins on both Ariane and Lawrence, unlike the earlier unconstrained directional search."],"next_action_hint":"Inspect Lawrence's chosen side-specific extras and consider whether the same tightly constrained local directional refinement is worth trying on Kathryn or Noam/Valeria next."}}
{"run":65,"commit":"d078b36","metric":2.996080081207246,"metrics":{"total_abs_delta":10134,"ratio_log_error":1.0591407105661959,"worst_person_error":0.6115433562852444,"matched_rows":11},"status":"keep","description":"Extend the constrained one-extra-per-side directional local search to Kathryn Ruemmler as well.","timestamp":1774388713850,"segment":0,"confidence":4.392420740262508,"asi":{"hypothesis":"Kathryn has an almost perfect ratio but a huge remaining undercount, so one side-specific alias on top of the shared core may add a little missing volume without destabilizing directionality.","observations":["combined_error improved from 2.996138 to 2.996080.","total_abs_delta improved from 10135 to 10134.","The gain is tiny but real and came without worsening worst-person error.","The constrained directional refinement appears broadly safe on another asymmetric undercounted case."],"next_action_hint":"Inspect Kathryn's chosen side-specific extras; if they are sensible, try the same constrained local refinement on Noam/Valeria next."}}
{"run":66,"commit":"d078b36","metric":2.996080081207246,"metrics":{"total_abs_delta":10134,"ratio_log_error":1.0591407105661959,"worst_person_error":0.6115433562852444,"matched_rows":11},"status":"discard","description":"Try the same constrained one-extra-per-side directional local search on Noam and Valeria Chomsky.","timestamp":1774388869211,"segment":0,"confidence":4.580843097142264,"asi":{"hypothesis":"Noam/Valeria still have a large undercount and a width-saturated shared solution, so one side-specific alias might help like it did for Ariane, Lawrence, and Kathryn.","rollback_reason":"The directional local refinement made no difference at all for Noam/Valeria, so their current miss is not explained by a single asymmetric extra alias.","observations":["The constrained directional trick is not universally useful; it helped only some asymmetric hard cases.","Noam/Valeria likely need better candidate quality rather than one more side-specific add-on.","This narrows the remaining profitable targets for the local directional refinement."],"next_action_hint":"Keep the directional local search on Ariane/Lawrence/Kathryn only, and look next at Elon or Bill with more targeted candidate-quality changes."}}
{"run":67,"commit":"d078b36","metric":2.996080081207246,"metrics":{"total_abs_delta":10134,"ratio_log_error":1.0591407105661959,"worst_person_error":0.6115433562852444,"matched_rows":11},"status":"discard","description":"Try the inverse constrained directional refinement on Bill Gates, Elon Musk, and Reid Hoffman by allowing one sender-side and/or recipient-side alias to be dropped from the shared set.","timestamp":1774389233861,"segment":0,"confidence":4.786155557839497,"asi":{"hypothesis":"The remaining Bill/Elon/Reid errors are overcount-heavy, so a tightly constrained side-specific removal might trim one bad alias without destabilizing the whole shared match.","rollback_reason":"The side-specific drop refinement changed nothing at all for these names, so their current overcounts are not explained by a single removable side-specific alias.","observations":["This local pruning trick is much less useful than the local additive directional refinement.","Bill and Elon are probably limited by candidate quality rather than one bad extra key inside the winning set.","Reid also appears stable under single-key directional deletions."],"next_action_hint":"Keep the additive local directional refinement for the undercounted asymmetric people only, and pivot to more targeted candidate-generation improvements for Bill/Elon/Reid."}}
{"run":68,"commit":"9636140","metric":2.9916870996596363,"metrics":{"total_abs_delta":10124,"ratio_log_error":1.056064731520891,"worst_person_error":0.6115433562852444,"matched_rows":11},"status":"keep","description":"Strengthen the constrained directional local search for Ariane, Lawrence, and Kathryn by allowing up to two sender-only and up to two recipient-only extra aliases on top of the shared core.","timestamp":1774389500102,"segment":0,"confidence":4.727284891282693,"asi":{"hypothesis":"The one-extra-per-side local refinement worked repeatedly on the big undercounted asymmetric people, so a still-small two-extra-per-side search may recover a bit more missed volume without the overfitting of unconstrained directional search.","observations":["combined_error improved from 2.996080 to 2.991687.","total_abs_delta improved from 10134 to 10124.","ratio_log_error improved from 1.059141 to 1.056065.","The broader local refinement kept helping only on the anchored undercounted cases and remained much safer than full independent directional search."],"next_action_hint":"Inspect which second extras were selected for Ariane/Lawrence/Kathryn, then consider whether this bounded local directional search is worth extending to one more undercounted case or tightening further with person-backed validation."}}
{"run":69,"commit":"9636140","metric":2.9916870996596363,"metrics":{"total_abs_delta":10124,"ratio_log_error":1.056064731520891,"worst_person_error":0.6115433562852444,"matched_rows":11},"status":"discard","description":"Extend the bounded two-extra-per-side directional local search to Noam and Valeria Chomsky too.","timestamp":1774389707760,"segment":0,"confidence":4.492946097021952,"asi":{"hypothesis":"Even though the one-extra version did nothing for Noam/Valeria, allowing up to two asymmetric extras might finally uncover the kind of low-volume tail aliases that helped Lawrence.","rollback_reason":"The stronger local directional search still made no difference at all for Noam/Valeria, so this family of refinements is exhausted there.","observations":["Noam/Valeria remain insensitive to these bounded directional adjustments.","The profitable local directional pattern is currently specific to Ariane, Lawrence, and Kathryn.","This makes the directional-search backlog narrower and cleaner."],"next_action_hint":"Prune Noam/Valeria directional expansion as stale and pivot back to Bill/Elon/Reid candidate-quality work."}}
{"run":70,"commit":"f9f6e8d","metric":2.990809637120132,"metrics":{"total_abs_delta":10122,"ratio_log_error":1.0554506694818477,"worst_person_error":0.6115433562852444,"matched_rows":11},"status":"keep","description":"Expand the anchored directional local search for Ariane, Lawrence, and Kathryn from two side-specific extras per side to three per side.","timestamp":1774389970795,"segment":0,"confidence":4.323472097341661,"asi":{"hypothesis":"The bounded local directional search is still yielding steady gains on the undercounted asymmetric cases, so allowing one more extra alias per side may recover a little more real volume before overfitting sets in.","observations":["combined_error improved from 2.991687 to 2.990810.","total_abs_delta improved from 10124 to 10122.","ratio_log_error improved from 1.056065 to 1.055451.","The anchored local refinement is still moving in the right direction and has not yet hit a clear plateau."],"next_action_hint":"Inspect whether only Lawrence changed again; if so, try one more bounded expansion for the same anchored directional search before pivoting away."}}
{"run":71,"commit":"f9f6e8d","metric":2.991063708247163,"metrics":{"total_abs_delta":10120,"ratio_log_error":1.0568561510867143,"worst_person_error":0.6115433562852444,"matched_rows":11},"status":"discard","description":"Test one more bounded expansion by allowing up to four side-specific extras per side in the anchored directional local search.","timestamp":1774390280598,"segment":0,"confidence":3.9798465510440075,"asi":{"hypothesis":"The steady improvements from one to three extras suggested there might still be one more useful low-volume alias hiding in the anchored directional tail.","rollback_reason":"The fourth extra improved total_abs_delta slightly but worsened ratio_log_error enough to miss the current best primary metric.","observations":["This looks like the first real sign of overfitting in the anchored directional expansion.","The three-extra setting appears to be the sweet spot so far.","Further widening this local search is now stale unless paired with stronger validation."],"next_action_hint":"Keep the three-extra bound and pivot to a different lever, likely person-specific candidate quality for Bill, Elon, or Reid."}}
