{"run":36,"commit":"ac77c63","metric":3.4737503325606394,"metrics":{"total_abs_delta":8446,"ratio_log_error":1.8531788007031502,"worst_person_error":1.0646536082755826,"matched_rows":11},"status":"discard","description":"Try person-specific directional subset search for Ariane so sender-side and recipient-side alias sets can differ.","timestamp":1774382540936,"segment":0,"confidence":1.9033006437163116,"asi":{"hypothesis":"Ariane appears heavily asymmetric across aliases, so forcing one shared key set may be the main reason her ratio is accurate but her total is far too low.","rollback_reason":"Independent directional subset selection overfit badly and blew up ratio_log_error, making combined_error far worse despite lowering total_abs_delta.","observations":["Separating sender and recipient key sets is directionally plausible but too unconstrained in this form.","The benchmark punishes asymmetric overfitting harder than it rewards the total recovery.","Any future directional search would need stronger allowlists or consistency constraints between the two sides."],"next_action_hint":"Revert to shared-key search and try narrower, alias-grounded person-specific tweaks instead of free directional optimization."}}
{"run":37,"commit":"ac77c63","metric":3.0259364896031333,"metrics":{"total_abs_delta":10277,"ratio_log_error":1.0743815882590215,"worst_person_error":0.6168397653180773,"matched_rows":11},"status":"discard","description":"Give Ariane de Rothschild a deeper candidate pool so lower-volume Rothschild variants can participate in the subset search.","timestamp":1774382730398,"segment":0,"confidence":2.259781429249202,"asi":{"hypothesis":"Ariane's 14-key cap may be clipping useful low-volume Rothschild aliases just below the cutoff, so a slightly wider candidate pool could improve her badly undercounted total.","rollback_reason":"The wider Ariane pool produced no improvement over the current best; the search landed on the exact same primary metric.","observations":["At least within this wider cutoff, the best combination did not change materially.","Ariane's miss is not just a candidate-cap problem.","The current bottleneck is likely the shared-key counting model or Jeffrey-side alias coverage, not missing one or two extra Ariane variants."],"next_action_hint":"Try a similarly targeted cap increase for Lawrence, or revisit carefully constrained Jeffrey alias recovery for the hardest undercounted people."}}
{"run":38,"commit":"a854675","metric":3.0120800090243836,"metrics":{"total_abs_delta":10183,"ratio_log_error":1.0729049312019363,"worst_person_error":0.6168397653180773,"matched_rows":11},"status":"keep","description":"Let Lawrence Krauss search a deeper candidate pool so genuine Krauss variants can survive behind the broad 'lawrence' collisions.","timestamp":1774382836548,"segment":0,"confidence":2.6206492117550146,"asi":{"hypothesis":"Lawrence's 14-key cap is probably clipping useful Krauss-specific aliases because the broad 'lawrence' token injects several unrelated high-volume keys ahead of them.","observations":["combined_error improved from 3.0259 to 3.0121.","total_abs_delta improved from 10277 to 10183.","ratio_log_error improved slightly from 1.0744 to 1.0729.","This suggests the cap itself was the bottleneck for Lawrence even before changing any include/exclude heuristics."],"next_action_hint":"Inspect the new Lawrence picks and consider whether another small cap increase for Lawrence or a similar one for other hard cases is still worthwhile."}}
{"run":39,"commit":"f94f7de","metric":3.0117458956535983,"metrics":{"total_abs_delta":10185,"ratio_log_error":1.068880780930782,"worst_person_error":0.6168397653180773,"matched_rows":11},"status":"keep","description":"Let Bill Gates search 14 candidates instead of 13 so one more low-volume Bill/Gates alias can compete in the subset search.","timestamp":1774382972981,"segment":0,"confidence":2.344401524501831,"asi":{"hypothesis":"Bill benefited immediately from one extra candidate before, so another small cap increase may still uncover a slightly better ratio/total tradeoff without broad heuristic changes.","observations":["combined_error improved from 3.0121 to 3.0117.","ratio_log_error improved from 1.0729 to 1.0689.","Bill Gates moved a hair closer while the rest of the table stayed effectively stable.","This continues the pattern that some hard correspondents are limited more by candidate truncation than by scoring."],"next_action_hint":"Check whether Bill or Lawrence still have useful aliases just beyond the current cap, and consider similar small cap bumps for Reid or Elon if their candidate lists are also clipping plausible variants."}}
{"run":40,"commit":"7e522e8","metric":3.0113610781730102,"metrics":{"total_abs_delta":10188,"ratio_log_error":1.0667688477334414,"worst_person_error":0.6168397653180773,"matched_rows":11},"status":"keep","description":"Let Reid Hoffman search 14 candidates instead of 13 so one more plausible Hoffman/Reid variant can compete against the generic first-name clutter.","timestamp":1774383103296,"segment":0,"confidence":2.1920731465636476,"asi":{"hypothesis":"Reid's candidate list is also crowded by generic first-name collisions, so a small cap increase may let a more specific Hoffman alias beat one of the weak generic variants.","observations":["combined_error improved from 3.0117 to 3.0114.","ratio_log_error improved from 1.0689 to 1.0668.","total_abs_delta barely moved, so this was mostly a ratio-side cleanup.","This reinforces that modest per-person cap tuning is still finding real headroom."],"next_action_hint":"Probe Elon with a similar cap increase, or inspect whether Lawrence still benefits from one more expansion step beyond 17."}}
{"run":41,"commit":"7e522e8","metric":3.0132766033340657,"metrics":{"total_abs_delta":10186,"ratio_log_error":1.0731586458251452,"worst_person_error":0.6168397653180773,"matched_rows":11},"status":"discard","description":"Exclude the recurring Elon false-positive delon/delongh alias family from candidate generation.","timestamp":1774383347615,"segment":0,"confidence":2.1923417937859977,"asi":{"hypothesis":"Elon's remaining overcount is still partly caused by ceciledelongh/delondemetz-style substring collisions, so banning that family should help without harming genuine Musk aliases.","rollback_reason":"The targeted delon/delongh exclusions were worse than the current best, so those false positives are not the main limiting factor anymore.","observations":["Elon's row changed in the expected direction only slightly, but not enough to improve the global metric.","The current best is being driven more by candidate-cap tuning on other people than by further Elon cleanup.","Ariane is still the worst-person bottleneck."],"next_action_hint":"Look for another candidate-cap win on Lawrence/Bill/Reid, or revisit Ariane with a more alias-grounded tweak rather than substring exclusions."}}
{"run":42,"commit":"7e522e8","metric":3.026975326590022,"metrics":{"total_abs_delta":10289,"ratio_log_error":1.0690813708771747,"worst_person_error":0.6168397653180773,"matched_rows":11},"status":"discard","description":"Promote more explicit Lawrence Krauss variants into the preferred candidate list so they outrank generic 'lawrence' collisions.","timestamp":1774383535811,"segment":0,"confidence":2.224788219793161,"asi":{"hypothesis":"The Lawrence improvement from a deeper cap suggests real Krauss aliases are being crowded out, so explicitly preferring redacted/email variants may help them enter the winning subset.","rollback_reason":"The broader Lawrence prefer list made the solution worse overall, likely by displacing the high-volume aliases the search currently relies on to approach the target total.","observations":["Lawrence's match is still partly leaning on non-Krauss 'lawrence' aliases to recover volume.","Forcing more Krauss-only variants to the front reduced that volume without enough compensating precision gain.","Simple prefer-list promotion is too blunt here."],"next_action_hint":"Try a smaller cap increase on one of the already improving people, or inspect Ariane for another cap/ordering adjustment rather than forcing explicit Lawrence variants."}}
{"run":43,"commit":"7e522e8","metric":3.0113610781730102,"metrics":{"total_abs_delta":10188,"ratio_log_error":1.0667688477334414,"worst_person_error":0.6168397653180773,"matched_rows":11},"status":"discard","description":"Try pushing Bill Gates one step further to a 15-candidate search cap.","timestamp":1774383699679,"segment":0,"confidence":2.216764441472269,"asi":{"hypothesis":"Bill still looked candidate-cap sensitive after the 14-key improvement, so one more slot might uncover an even better low-volume alias combination.","rollback_reason":"The extra Bill slot gave back the previous tiny gain and landed on the older 3.01136 result instead of improving further.","observations":["Bill seems to have a sweet spot around the 14-key cap.","Going wider likely reintroduced weaker generic Bill aliases without adding anything genuinely useful.","Not every person benefits monotonically from wider search."],"next_action_hint":"Keep Bill at 14 and test a similar one-step cap increase for Ariane, Kathryn, or Noam/Valeria only if their candidate tails look plausibly useful."}}
{"run":44,"commit":"7e522e8","metric":3.0113610781730102,"metrics":{"total_abs_delta":10188,"ratio_log_error":1.0667688477334414,"worst_person_error":0.6168397653180773,"matched_rows":11},"status":"discard","description":"Give Kathryn Ruemmler a wider 16-candidate search cap so additional Ruemmler-specific variants can enter the subset search.","timestamp":1774383903182,"segment":0,"confidence":2.184283196288059,"asi":{"hypothesis":"Kathryn is still badly undercounted despite near-perfect ratio, so a few more low-volume Ruemmler variants may add missing total without disturbing directionality.","rollback_reason":"The wider Kathryn candidate pool did not improve the current best and reverted to the older 3.01136 result.","observations":["Kathryn's best subset appears stable under this modest cap increase.","Her undercount is probably not caused by clipping one or two extra Ruemmler variants.","The current gains are coming more from Bill/Lawrence/Reid cap tuning than from Kathryn expansion."],"next_action_hint":"Leave Kathryn at the old cap and try another incremental tweak on a candidate-sensitive person, or revisit Ariane/Jeffrey-side coverage."}}
{"run":45,"commit":"7ab75d1","metric":3.0111070070459793,"metrics":{"total_abs_delta":10190,"ratio_log_error":1.0653633661285749,"worst_person_error":0.6168397653180773,"matched_rows":11},"status":"keep","description":"Push Reid Hoffman one step further to a 16-candidate cap so later specific Hoffman variants can compete past the noisy generic Reid tail.","timestamp":1774384125468,"segment":0,"confidence":2.158872523091176,"asi":{"hypothesis":"Reid still looked cap-sensitive, and the 16th slot finally reaches another clearly Reid/Hoffman-specific variant after one weak generic alias.","observations":["combined_error improved from 3.0114 to 3.0111.","ratio_log_error improved from 1.0668 to 1.0654.","total_abs_delta worsened slightly from 10188 to 10190, so the gain is almost entirely ratio-side.","This suggests the extra Reid-specific candidate helped clean up directionality even without fixing volume."],"next_action_hint":"Inspect Reid's new picked keys and see whether a targeted prefer/exclude tweak can capture the same benefit more directly, or test a similarly surgical cap move on another ratio-heavy miss."}}
{"run":46,"commit":"93c42bc","metric":3.0093659519052567,"metrics":{"total_abs_delta":10183,"ratio_log_error":1.0645442127394655,"worst_person_error":0.6168397653180773,"matched_rows":11},"status":"keep","description":"Let Lawrence Krauss search 10-key subsets instead of stopping at width 9, since his best solution was already saturating the old width cap.","timestamp":1774384368196,"segment":0,"confidence":2.622992863672807,"asi":{"hypothesis":"Lawrence's improving solution was already using nine aliases, so the old width cap was probably truncating one more useful low-volume alias that could add volume without wrecking ratio.","observations":["combined_error improved from 3.0111 to 3.0094.","total_abs_delta improved from 10190 to 10183.","ratio_log_error improved from 1.0654 to 1.0645.","This is the strongest recent signal that the subset-width ceiling, not just candidate ordering, was constraining Lawrence."],"next_action_hint":"Inspect Lawrence's new picked set and consider whether one more width bump for Lawrence or a width bump for another saturated person is justified."}}
{"run":47,"commit":"97ffefa","metric":3.0080419147206934,"metrics":{"total_abs_delta":10180,"ratio_log_error":1.063615276305594,"worst_person_error":0.6168397653180773,"matched_rows":11},"status":"keep","description":"Extend Lawrence Krauss one more step to 11-key subsets after the 10-key search was still adding useful low-volume aliases.","timestamp":1774384546313,"segment":0,"confidence":3.3321609886499495,"asi":{"hypothesis":"Lawrence's solution likely still has one more productive alias beyond the new 10-key subset, so raising the width cap to 11 could keep reducing his large total undercount.","observations":["combined_error improved from 3.0094 to 3.0080.","total_abs_delta improved from 10183 to 10180.","ratio_log_error improved from 1.0645 to 1.0636.","Lawrence continues to be the clearest beneficiary of wider subset search."],"next_action_hint":"Check whether Lawrence's winning subset is now saturating 11 as well; if so, test 12 before touching more heuristic-heavy changes."}}
{"run":48,"commit":"97ffefa","metric":3.0080419147206934,"metrics":{"total_abs_delta":10180,"ratio_log_error":1.063615276305594,"worst_person_error":0.6168397653180773,"matched_rows":11},"status":"discard","description":"Test whether Lawrence Krauss still benefits from allowing 12-key subsets instead of stopping at 11.","timestamp":1774384738903,"segment":0,"confidence":3.6359322461609906,"asi":{"hypothesis":"Lawrence's winning subset kept saturating the width cap, so one more expansion step might still recover a useful low-volume alias.","rollback_reason":"The 12-key allowance produced no improvement over the current best, so Lawrence's headroom appears exhausted at width 11.","observations":["The best metric stayed exactly flat relative to the 11-key version.","Lawrence's remaining miss is no longer just a width-cap issue.","Further gains probably need a different structural change or another person-specific tweak."],"next_action_hint":"Keep Lawrence at width 11 and pivot back to Ariane/Elon or another low-risk cap/ordering change on the remaining hard cases."}}
{"run":49,"commit":"01fdb95","metric":3.0060244129564744,"metrics":{"total_abs_delta":10166,"ratio_log_error":1.0641285048378317,"worst_person_error":0.614822263553858,"matched_rows":11},"status":"keep","description":"Let Ariane de Rothschild search 10-key subsets instead of stopping at width 9, since her best match was also saturating the old width cap.","timestamp":1774384917397,"segment":0,"confidence":4.043466095328097,"asi":{"hypothesis":"Ariane's match was stuck on a 9-key subset with a huge total undercount, so one more low-volume alias may add needed volume while preserving her already-good ratio.","observations":["combined_error improved from 3.0080 to 3.0060.","total_abs_delta improved from 10180 to 10166.","worst_person_error improved from 0.6168 to 0.6148.","Ariane, like Lawrence, was materially constrained by the width cap rather than candidate filtering alone."],"next_action_hint":"Inspect Ariane's new picked set; if it now saturates width 10, test width 11 before moving to riskier heuristic changes."}}
{"run":50,"commit":"01fdb95","metric":3.0060244129564744,"metrics":{"total_abs_delta":10166,"ratio_log_error":1.0641285048378317,"worst_person_error":0.614822263553858,"matched_rows":11},"status":"discard","description":"Check whether Ariane de Rothschild still benefits from going from width 10 to width 11 subsets.","timestamp":1774385090880,"segment":0,"confidence":4.034128529430132,"asi":{"hypothesis":"Ariane's width-10 solution might still have one more useful low-volume alias to add after the previous gain.","rollback_reason":"Allowing width 11 produced no further improvement, so Ariane's width-related headroom appears exhausted at 10.","observations":["The best metric stayed exactly flat relative to the width-10 version.","Ariane improved once the hard width ceiling moved, but not beyond that.","Further Ariane gains will likely require better candidate quality or Jeffrey-side coverage, not more subset width."],"next_action_hint":"Keep Ariane at width 10 and look for another saturated person or a more structural fix for Elon/Ariane."}}
{"run":51,"commit":"01fdb95","metric":3.0060244129564744,"metrics":{"total_abs_delta":10166,"ratio_log_error":1.0641285048378317,"worst_person_error":0.614822263553858,"matched_rows":11},"status":"discard","description":"Allow Noam and Valeria Chomsky to search 10-key subsets because their current match was also saturating width 9.","timestamp":1774385266851,"segment":0,"confidence":4.024833990603887,"asi":{"hypothesis":"The Chomsky pair may have the same hidden width-cap issue as Lawrence and Ariane, with one more low-volume alias improving the undercount.","rollback_reason":"The wider Noam/Valeria search made no difference at all, so their current solution is not constrained by subset width in practice.","observations":["Not every saturated width-9 solution has real extra headroom behind it.","The successful width-cap wins seem specific to Lawrence and Ariane.","Noam/Valeria likely need better alias quality rather than more subset breadth."],"next_action_hint":"Try width 10 for Reid Hoffman next, since Reid is also saturated and still ratio-heavy."}}
{"run":52,"commit":"01fdb95","metric":3.0060244129564744,"metrics":{"total_abs_delta":10166,"ratio_log_error":1.0641285048378317,"worst_person_error":0.614822263553858,"matched_rows":11},"status":"discard","description":"Allow Reid Hoffman to search 10-key subsets because his current match is also saturating width 9.","timestamp":1774385483176,"segment":0,"confidence":4.028655267116536,"asi":{"hypothesis":"Reid's ratio-heavy error may still have a hidden width-cap bottleneck similar to Ariane's, where one more alias improves directionality.","rollback_reason":"The wider Reid subset search produced no change at all, so his current match is not actually limited by the width-9 ceiling.","observations":["Reid benefited from a larger candidate pool, but not from a larger subset width.","That means the valuable extra aliases are replacing older picks rather than simply being appended.","Width tuning is no longer the right lever for Reid."],"next_action_hint":"Focus on targeted candidate ordering or exclusions for Reid, or return to the still-unresolved Elon problem."}}
{"run":53,"commit":"01fdb95","metric":3.008194009244561,"metrics":{"total_abs_delta":10162,"ratio_log_error":1.0719237845344023,"worst_person_error":0.614822263553858,"matched_rows":11},"status":"discard","description":"Filter Elon candidates down to Musk/Elon/Eton-shaped keys after ranking, instead of allowing arbitrary substring collisions like ceciledelongh.","timestamp":1774385659294,"segment":0,"confidence":4.047944097159587,"asi":{"hypothesis":"A shape-based Elon filter should remove the obvious false positives while preserving the genuine typo variants that helped earlier.","rollback_reason":"This made the global metric worse because the tighter Elon pool reduced total_abs_delta slightly but increased ratio_log_error too much.","observations":["The cleaner-looking Elon candidate set still moved the row in the wrong overall direction.","Elon's benchmark target likely depends on at least one ugly non-obvious alias, or on counts the current Jeff-side model still misses.","This confirms that visually plausible alias filtering can still over-prune useful coverage."],"next_action_hint":"Revert the Elon shape filter and keep hunting for gains elsewhere, or revisit Jeffrey alias recovery with stronger evidence requirements."}}
{"run":54,"commit":"01fdb95","metric":3.0060244129564744,"metrics":{"total_abs_delta":10166,"ratio_log_error":1.0641285048378317,"worst_person_error":0.614822263553858,"matched_rows":11},"status":"discard","description":"Re-test a deeper Ariane de Rothschild candidate pool after the width-10 win, in case extra low-volume Rothschild variants only become useful once the width cap is relaxed.","timestamp":1774386003966,"segment":0,"confidence":3.9811981135459296,"asi":{"hypothesis":"Ariane's earlier cap increase may have failed only because the width cap was still too tight; with width 10, extra candidate tail aliases might now matter.","rollback_reason":"Even after the width-10 improvement, widening Ariane's candidate cap still made no difference at all.","observations":["Ariane's remaining miss is not hidden just below the current candidate cutoff.","Her current bottleneck is more about candidate quality or the counting model than raw candidate depth.","This makes the old 'deeper Ariane pool' idea stale again."],"next_action_hint":"Prune the stale Ariane cap idea from the backlog and pivot to Jeffrey-side alias evidence or a different counting model."}}
